[
  { "id": "msg-001", "clientId": "client-1", "userId": "user-1", "deviceId": "dev-001", "topic": "approvals", "title": "Новый запрос на согласование", "body": "Запрос на перевод $50,000 ожидает вашего подтверждения", "deepLink": "/m/tasks/item/task-001", "status": "unread", "priority": "high", "createdAt": "2025-01-15T10:00:00Z" },
  { "id": "msg-002", "clientId": "client-1", "userId": "user-1", "deviceId": "dev-001", "topic": "reports", "title": "Отчет готов", "body": "Квартальный отчет по портфелю доступен для просмотра", "deepLink": "/m/reports/item/rep-001", "status": "read", "priority": "normal", "createdAt": "2025-01-14T15:00:00Z", "readAt": "2025-01-14T16:00:00Z" },
  { "id": "msg-003", "clientId": "client-1", "userId": "user-1", "topic": "risk", "title": "Risk Alert", "body": "Обнаружено превышение лимита концентрации в секторе Tech", "deepLink": "/m/risk/item/alert-001", "status": "unread", "priority": "urgent", "createdAt": "2025-01-15T09:30:00Z" },
  { "id": "msg-004", "clientId": "client-2", "userId": "user-2", "deviceId": "dev-003", "topic": "invoices", "title": "Новый счет", "body": "Счет на $2,500 за Q4 management fee", "deepLink": "/m/fees/item/inv-001", "status": "unread", "priority": "normal", "createdAt": "2025-01-15T08:00:00Z" },
  { "id": "msg-005", "clientId": "client-2", "userId": "user-2", "topic": "documents", "title": "Новый документ", "body": "Добавлен документ: Annual Investment Review 2024", "deepLink": "/m/documents/item/doc-001", "status": "read", "priority": "low", "createdAt": "2025-01-13T11:00:00Z", "readAt": "2025-01-13T14:00:00Z" },
  { "id": "msg-006", "clientId": "client-3", "userId": "user-3", "deviceId": "dev-005", "topic": "approvals", "title": "Срочное согласование", "body": "Rebalancing портфеля требует подтверждения до конца дня", "deepLink": "/m/tasks/item/task-002", "status": "unread", "priority": "urgent", "createdAt": "2025-01-15T07:00:00Z" },
  { "id": "msg-007", "clientId": "client-3", "userId": "user-3", "topic": "alerts", "title": "Системное уведомление", "body": "Плановое обслуживание системы 17 января с 02:00 до 04:00", "deepLink": "/m/admin/announcements", "status": "read", "priority": "normal", "createdAt": "2025-01-12T10:00:00Z", "readAt": "2025-01-12T12:00:00Z" },
  { "id": "msg-008", "clientId": "client-4", "userId": "user-4", "deviceId": "dev-007", "topic": "messages", "title": "Новое сообщение", "body": "Сообщение от вашего advisor: John Smith", "deepLink": "/m/comms/thread/thr-001", "status": "unread", "priority": "normal", "createdAt": "2025-01-15T06:00:00Z" },
  { "id": "msg-009", "clientId": "client-4", "userId": "user-4", "topic": "reports", "title": "Tax Report Ready", "body": "Налоговый отчет за 2024 год готов к загрузке", "deepLink": "/m/tax/item/tax-001", "status": "unread", "priority": "high", "createdAt": "2025-01-14T14:00:00Z" },
  { "id": "msg-010", "clientId": "client-5", "userId": "user-5", "deviceId": "dev-010", "topic": "tasks", "title": "Задача просрочена", "body": "Задача 'Подписать IPS' просрочена на 2 дня", "deepLink": "/m/tasks/item/task-003", "status": "unread", "priority": "high", "createdAt": "2025-01-15T05:00:00Z" },
  { "id": "msg-011", "clientId": "client-5", "userId": "user-5", "topic": "risk", "title": "Portfolio Alert", "body": "Волатильность портфеля превысила целевой уровень", "deepLink": "/m/risk/item/alert-002", "status": "read", "priority": "high", "createdAt": "2025-01-14T09:00:00Z", "readAt": "2025-01-14T10:00:00Z" },
  { "id": "msg-012", "clientId": "client-6", "userId": "user-6", "deviceId": "dev-011", "topic": "messages", "title": "Ответ получен", "body": "Advisor ответил на ваш вопрос о allocation", "deepLink": "/m/comms/thread/thr-002", "status": "unread", "priority": "normal", "createdAt": "2025-01-14T20:00:00Z" },
  { "id": "msg-013", "clientId": "client-6", "userId": "user-6", "topic": "documents", "title": "Документ обновлен", "body": "Обновлена версия IPS документа", "deepLink": "/m/ips/item/ips-001", "status": "read", "priority": "normal", "createdAt": "2025-01-13T16:00:00Z", "readAt": "2025-01-13T17:00:00Z" },
  { "id": "msg-014", "clientId": "client-7", "userId": "user-7", "deviceId": "dev-013", "topic": "invoices", "title": "Платеж подтвержден", "body": "Ваш платеж $1,800 успешно обработан", "deepLink": "/m/fees/item/inv-002", "status": "read", "priority": "normal", "createdAt": "2025-01-12T11:00:00Z", "readAt": "2025-01-12T11:30:00Z" },
  { "id": "msg-015", "clientId": "client-7", "userId": "user-7", "topic": "reports", "title": "Monthly Statement", "body": "Ежемесячная выписка за декабрь доступна", "deepLink": "/m/reports/item/rep-002", "status": "unread", "priority": "normal", "createdAt": "2025-01-10T09:00:00Z" },
  { "id": "msg-016", "clientId": "client-8", "userId": "user-8", "deviceId": "dev-016", "topic": "tasks", "title": "Напоминание", "body": "Напоминание: Заполнить анкету KYC до 20 января", "deepLink": "/m/onboarding/item/case-001", "status": "unread", "priority": "high", "createdAt": "2025-01-15T04:00:00Z" },
  { "id": "msg-017", "clientId": "client-8", "userId": "user-8", "topic": "alerts", "title": "Security Alert", "body": "Обнаружен вход с нового устройства", "deepLink": "/m/security/devices", "status": "unread", "priority": "urgent", "createdAt": "2025-01-14T23:00:00Z" },
  { "id": "msg-018", "clientId": "client-1", "userId": "user-1", "topic": "approvals", "title": "Согласование выполнено", "body": "Wire transfer на $25,000 одобрен", "deepLink": "/m/tasks/item/task-004", "status": "read", "priority": "normal", "createdAt": "2025-01-13T10:00:00Z", "readAt": "2025-01-13T10:15:00Z" },
  { "id": "msg-019", "clientId": "client-2", "userId": "user-2", "topic": "risk", "title": "Compliance Notice", "body": "Требуется обновление документов AML", "deepLink": "/m/security/compliance", "status": "read", "priority": "high", "createdAt": "2025-01-11T14:00:00Z", "readAt": "2025-01-11T15:00:00Z" },
  { "id": "msg-020", "clientId": "client-3", "userId": "user-3", "topic": "messages", "title": "Team Update", "body": "Новый advisor присоединился к вашей команде", "deepLink": "/m/admin/team", "status": "read", "priority": "low", "createdAt": "2025-01-10T08:00:00Z", "readAt": "2025-01-10T09:00:00Z" },
  { "id": "msg-021", "clientId": "client-1", "userId": "user-1", "topic": "documents", "title": "Подпись требуется", "body": "Документ 'Amendment Agreement' ожидает подписи", "deepLink": "/m/documents/item/doc-002", "status": "unread", "priority": "high", "createdAt": "2025-01-15T11:00:00Z" },
  { "id": "msg-022", "clientId": "client-2", "userId": "user-2", "topic": "reports", "title": "Performance Update", "body": "Еженедельный performance report готов", "deepLink": "/m/reports/item/rep-003", "status": "unread", "priority": "normal", "createdAt": "2025-01-15T07:30:00Z" },
  { "id": "msg-023", "clientId": "client-3", "userId": "user-3", "topic": "invoices", "title": "Invoice Reminder", "body": "Напоминание об оплате счета #INV-2024-089", "deepLink": "/m/fees/item/inv-003", "status": "unread", "priority": "normal", "createdAt": "2025-01-14T08:00:00Z" },
  { "id": "msg-024", "clientId": "client-4", "userId": "user-4", "topic": "tasks", "title": "New Task Assigned", "body": "Вам назначена задача: Review Q1 Goals", "deepLink": "/m/tasks/item/task-005", "status": "read", "priority": "normal", "createdAt": "2025-01-13T09:00:00Z", "readAt": "2025-01-13T10:00:00Z" },
  { "id": "msg-025", "clientId": "client-5", "userId": "user-5", "topic": "alerts", "title": "Market Alert", "body": "Значительное движение в секторе Energy", "deepLink": "/m/risk/market", "status": "read", "priority": "high", "createdAt": "2025-01-12T15:00:00Z", "readAt": "2025-01-12T15:30:00Z" },
  { "id": "msg-026", "clientId": "client-6", "userId": "user-6", "topic": "approvals", "title": "Approval Request", "body": "Запрос на изменение бенчмарка портфеля", "deepLink": "/m/ips/item/ips-002", "status": "unread", "priority": "normal", "createdAt": "2025-01-15T08:30:00Z" },
  { "id": "msg-027", "clientId": "client-7", "userId": "user-7", "topic": "documents", "title": "Document Shared", "body": "С вами поделились документом: Estate Plan Summary", "deepLink": "/m/documents/item/doc-003", "status": "read", "priority": "normal", "createdAt": "2025-01-11T13:00:00Z", "readAt": "2025-01-11T14:00:00Z" },
  { "id": "msg-028", "clientId": "client-8", "userId": "user-8", "topic": "risk", "title": "Liquidity Warning", "body": "Уровень ликвидности портфеля ниже целевого", "deepLink": "/m/risk/item/alert-003", "status": "unread", "priority": "high", "createdAt": "2025-01-14T16:00:00Z" },
  { "id": "msg-029", "clientId": "client-1", "userId": "user-1", "topic": "messages", "title": "Meeting Scheduled", "body": "Встреча с advisor запланирована на 18 января", "deepLink": "/m/comms/thread/thr-003", "status": "read", "priority": "normal", "createdAt": "2025-01-10T11:00:00Z", "readAt": "2025-01-10T12:00:00Z" },
  { "id": "msg-030", "clientId": "client-2", "userId": "user-2", "topic": "tasks", "title": "Task Completed", "body": "Задача 'Upload Tax Documents' завершена", "deepLink": "/m/tasks/item/task-006", "status": "read", "priority": "low", "createdAt": "2025-01-09T16:00:00Z", "readAt": "2025-01-09T17:00:00Z" }
]
